发文者,标题,封面链接,链接,down_link
全球速报,特朗普、马克龙和泽连斯基举行三方会晤,E:\python\flaskProject\static\content\特朗普、马克龙和泽连斯基举行三方会晤.jpg,https://m.thepaper.cn/newsDetail_forward_29583969,/content/特朗普、马克龙和泽连斯基举行三方会晤.jpg
中国政库,老山战斗英雄原明逝世，曾带敢死队13分钟拔掉敌人两个据点,E:\python\flaskProject\static\content\老山战斗英雄原明逝世，曾带敢死队13分钟拔掉敌人两个据点.jpg,https://m.thepaper.cn/newsDetail_forward_29586531,/content/老山战斗英雄原明逝世，曾带敢死队13分钟拔掉敌人两个据点.jpg
全球速报,浴火重生！巴黎圣母院今日正式对公众重新开放,E:\python\flaskProject\static\content\浴火重生！巴黎圣母院今日正式对公众重新开放.jpg,https://m.thepaper.cn/newsDetail_forward_29585973,/content/浴火重生！巴黎圣母院今日正式对公众重新开放.jpg
澎湃防务,观察｜法国派航母到“印太”彰显军事存在，但有点力不从心,E:\python\flaskProject\static\content\观察｜法国派航母到“印太”彰显军事存在，但有点力不从心.jpg,https://m.thepaper.cn/newsDetail_forward_29580279,/content/观察｜法国派航母到“印太”彰显军事存在，但有点力不从心.jpg
追光灯,郎朗在巴黎圣母院演奏圣桑《第二钢琴协奏曲》,E:\python\flaskProject\static\content\郎朗在巴黎圣母院演奏圣桑《第二钢琴协奏曲》.jpg,https://m.thepaper.cn/newsDetail_forward_29586539,/content/郎朗在巴黎圣母院演奏圣桑《第二钢琴协奏曲》.jpg
大国外交,外交部发言人就叙利亚局势答记者问：我驻叙利亚使馆仍在坚守,E:\python\flaskProject\static\content\外交部发言人就叙利亚局势答记者问：我驻叙利亚使馆仍在坚守.jpg,https://m.thepaper.cn/newsDetail_forward_29587938,/content/外交部发言人就叙利亚局势答记者问：我驻叙利亚使馆仍在坚守.jpg
全球速报,韩国检察厅：尹锡悦涉嫌滥用职权和内乱罪被立案调查,E:\python\flaskProject\static\content\韩国检察厅：尹锡悦涉嫌滥用职权和内乱罪被立案调查.jpg,https://m.thepaper.cn/newsDetail_forward_29586850,/content/韩国检察厅：尹锡悦涉嫌滥用职权和内乱罪被立案调查.jpg
运动家,11战全胜！国乒强势卫冕国际乒联混合团体世界杯冠军,E:\python\flaskProject\static\content\11战全胜！国乒强势卫冕国际乒联混合团体世界杯冠军.jpg,https://m.thepaper.cn/newsDetail_forward_29588455,/content/11战全胜！国乒强势卫冕国际乒联混合团体世界杯冠军.jpg
古代艺术,文化中国行·长江之歌｜苏州核雕的记忆与技艺,E:\python\flaskProject\static\content\文化中国行·长江之歌｜苏州核雕的记忆与技艺.jpg,https://m.thepaper.cn/newsDetail_forward_29583686,/content/文化中国行·长江之歌｜苏州核雕的记忆与技艺.jpg
浦江头条,胡广杰任上海普陀区委书记,E:\python\flaskProject\static\content\胡广杰任上海普陀区委书记.jpg,https://m.thepaper.cn/newsDetail_forward_29588138,/content/胡广杰任上海普陀区委书记.jpg
人事风向,西藏自治区党委副书记、自治区常务副主席陈永奇已任江西省委副书记,E:\python\flaskProject\static\content\西藏自治区党委副书记、自治区常务副主席陈永奇已任江西省委副书记.jpg,https://m.thepaper.cn/newsDetail_forward_29585969,/content/西藏自治区党委副书记、自治区常务副主席陈永奇已任江西省委副书记.jpg
直击现场,山东威海一冷库发生火灾，9人遇难,E:\python\flaskProject\static\content\山东威海一冷库发生火灾，9人遇难.jpg,https://m.thepaper.cn/newsDetail_forward_29586333,/content/山东威海一冷库发生火灾，9人遇难.jpg
全球速报,俄土伊外长在多哈举行会谈，三方宣布支持叙领土完整和政治统一,E:\python\flaskProject\static\content\俄土伊外长在多哈举行会谈，三方宣布支持叙领土完整和政治统一.jpg,https://m.thepaper.cn/newsDetail_forward_29583764,/content/俄土伊外长在多哈举行会谈，三方宣布支持叙领土完整和政治统一.jpg
科学湃,生活在30万年前，华龙洞人是东亚向智人演化的最早古人类,E:\python\flaskProject\static\content\生活在30万年前，华龙洞人是东亚向智人演化的最早古人类.jpg,https://m.thepaper.cn/newsDetail_forward_29586678,/content/生活在30万年前，华龙洞人是东亚向智人演化的最早古人类.jpg
澎湃早晚报早餐湃,澎湃AI早新闻丨2024年12月8日,E:\python\flaskProject\static\content\澎湃AI早新闻丨2024年12月8日.jpg,https://m.thepaper.cn/newsDetail_forward_29586413,/content/澎湃AI早新闻丨2024年12月8日.jpg
文艺范,巴黎圣母院重新开放，郎朗马友友卡普松杜达梅尔见证重生时刻,E:\python\flaskProject\static\content\巴黎圣母院重新开放，郎朗马友友卡普松杜达梅尔见证重生时刻.jpg,https://m.thepaper.cn/newsDetail_forward_29586682,/content/巴黎圣母院重新开放，郎朗马友友卡普松杜达梅尔见证重生时刻.jpg
时政湃,历史上的今天｜1941年12月8日，太平洋战争爆发,E:\python\flaskProject\static\content\历史上的今天｜1941年12月8日，太平洋战争爆发.jpg,https://m.thepaper.cn/newsDetail_forward_29556418,/content/历史上的今天｜1941年12月8日，太平洋战争爆发.jpg
全球速报,法国巴黎圣母院举行重新开放仪式,E:\python\flaskProject\static\content\法国巴黎圣母院举行重新开放仪式.jpg,https://m.thepaper.cn/newsDetail_forward_29584478,/content/法国巴黎圣母院举行重新开放仪式.jpg
浦江头条,“华东师范大学站”终于来了，上海这些地铁站都以高校命名,E:\python\flaskProject\static\content\“华东师范大学站”终于来了，上海这些地铁站都以高校命名.jpg,https://m.thepaper.cn/newsDetail_forward_29587085,/content/“华东师范大学站”终于来了，上海这些地铁站都以高校命名.jpg
绿政公署,中央气象台发布蓝色大风预警：较强冷空气将影响我国,E:\python\flaskProject\static\content\中央气象台发布蓝色大风预警：较强冷空气将影响我国.jpg,https://m.thepaper.cn/newsDetail_forward_29588178,/content/中央气象台发布蓝色大风预警：较强冷空气将影响我国.jpg
