平台,用户名,内容,分享数,评论数,点赞数,url,uni_id,发布时间
微博,,,0,0,0,https://m.weibo.cn/detail/N/A,,
微博,马孔多作坊,可能是最近总看李诞的小卖部直播吧，又刷到黑尾酱去英国读书的视频，感慨她真的好漂亮，于是在想俩人为什么be，翻到某篇文里写李诞喜欢黑尾酱的是她“幼稚天真，敏感忧伤”，想起他的两本书里关于典典的描述，李诞那句“我血是蓝色的啊朋友们”。两个敏感的人相爱。我天，破碎的少女心为之一动。 ,2,1,77,https://m.weibo.cn/detail/OzpDL3m54,OzpDL3m54,2024-09-30 20:23:14
微博,新浪娱乐,#徐志胜回应脱口秀大叫驴#  哈哈#没有人比徐志胜更懂嗓门大的痛#！他细数嗓门大的落寞时刻，“别人是春风化雨，我是春雷”，和司机聊天却被系统检测为吵架现场回应@李诞 评他“大叫驴脱口秀”演化成了“脱口秀大叫驴”，“前面那个，是在形容我的艺术风格，后面那个，是在剥夺我做人的资格！” ...全文,3,2,49,https://m.weibo.cn/detail/Ozxxs7uRi,,2024-10-01 16:29:40
微博,星冰乐kiki,李诞直播讲述股市大师段永平对自己的感触……祝大家找到热爱，并不痛苦的做下去。一直都觉得，世界上最幸运的事就是能找到自己热爱的事情，并努力下去，每一次的成就感都让自己很快乐。#A股疯涨普通人是否要入局# ,82,6,318,https://m.weibo.cn/detail/OzomfwACK,,2024-09-30 17:07:21
微博,老猫笔记,李诞说呼兰他A股大赚，两眼放光 老猫笔记的微博视频 ,3,4,35,https://m.weibo.cn/detail/OzmTzjGEn,OzmTzjGEn,2024-09-30 13:23:56
微博,你别说还真是这样,其实我觉得最好的脱口秀领笑员阵容是李诞、杨笠、鲁豫、大张伟，会把关会点评会聊天会鼓励支持。现在这几个节目就真的就跟评委一样，高高在上点评分析段子结构、价值分析、观众喜好什么… 还有罗永浩，看到好多repo都是在吐槽他爹味 ,22,34,873,https://m.weibo.cn/detail/Ozgs30thK,,2024-09-29 20:59:39
微博,南方周末,#李诞说外行不能理解贫嘴和幽默#【李诞：贫嘴，我是绝对不要的；幽默是少言，但准确的】李诞在《文学馆之夜》里谈到：“贫嘴和幽默的分别，是外行特别不能理解的。幽默是少言的，他进来的话，他一直在那贫嘴，我是绝对不要的，他虽然看起来很热闹很好笑，是绝对不要的。就是不说的人，就那么几个字很准 ...全文,11,14,53,https://m.weibo.cn/detail/Oz4gxd68O,Oz4gxd68O,2024-09-28 13:58:20
微博,,,0,0,0,https://m.weibo.cn/detail/N/A,,
微博,李诞工作室,李诞 朋友们事情没有你想的那么糟❗️这位姐妹说自己和男友感情稳定，却隐隐觉得危机四伏、波涛汹涌。@李诞 说不要给危机以关注，就不会有危机，不要给波涛以关注，它就不会汹涌。不要为了将来不一定发生的不好，惩罚现在的好，共勉！ 李诞工作室的微博视频 ,2,6,44,https://m.weibo.cn/detail/OzcVR58b0,,2024-09-29 12:02:06
微博,一千多岁大鲤鱼精,李诞以前的东西我没看过也不了解，印象中好像他也引起过一些争议，但是看这人直播，说的东西还挺实在的。  比如说一个女性问婚姻，就说自己原来在国外留学，回国相亲找了个老公，在二线城市，老公答应以后跟她出国生活，但是意愿越来越不强，英语也学不下去了，自己留在这个地方找工作也只有几千块钱的 ...全文,2,2,13,https://m.weibo.cn/detail/Oz8Bb6wRZ,Oz8Bb6wRZ,2024-09-29 01:00:11
微博,_彪形麗人孫大聖_,李诞在直播间聊到如何冥想，这两天对我帮助很大。他说冥想就是观察自己的呼吸，可能你会忍不住走神想别的事，但是没关系。你就想象你在火车站看着情绪像火车一样来来往往，可能你会跟着它往前走一段，但别走太远就回来。这样你就像一个看火车的人，心里知道：“哦，这些是我的情绪，它们会来，也会走。 ...全文,114,13,867,https://m.weibo.cn/detail/OyMsEwQhX,OyMsEwQhX,2024-09-26 16:38:44
微博,我又了解山姆了,李诞有点牛，我真怕他变成下一个蔡澜或是别的什么老饕。从来没在直播间买过东西，除了这个猪油酥酥，也就是猪油渣。上次在上海工作遇到李诞，他说猪油渣是温州一个威士忌吧尝到的，太惊艳了。我以为猪油渣顶了天了也就是像贵阳的脆哨罢了。我承认我错了，现在只要像他一样一躺着就吃一堆，这回真的真的 ...全文,9,20,428,https://m.weibo.cn/detail/OyFQPv7Yk,,2024-09-25 23:49:05
微博,Miss__Ostrich,谁懂脱人在节目里还能听到cue到李诞的段子的感觉希望后面再cue到的千万别剪 ,0,0,0,https://m.weibo.cn/detail/OzzAIzpR7,,2024-10-01 21:43:13
微博,用户28886,提前三个小时祝你生日快乐李瑞超  蛋蛋@李诞 天天开心健康平安 ,0,0,0,https://m.weibo.cn/detail/OzzuS73F6,,2024-10-01 21:28:48
微博,_Jiajia_h,《要的都是有亏欠》 可怜的现代人，感情上越来越蠢。 看李诞直播，感觉这届网友个个都做长期心理咨询，个个都在上亲密关系沟通课。PUA这种词是最初级了，回避型依恋、不配得感、trust issue……都信手拈来的，并形成了一套完整的、明显反复讲述过多次的自我叙事。但仍然，上了那么多课、读了那么多书， ...全文,0,0,0,https://m.weibo.cn/detail/Ozzuraj0D,,2024-10-01 21:27:44
微博,叫什么随便啦啊,老觉得这本书是Dan～！的学术生存日记（请用李诞读信的口气念出来），老没读下去，准备包个封面～～～￼ ,0,0,0,https://m.weibo.cn/detail/Ozzu6cBTe,,2024-10-01 21:26:54
微博,小簌susu,8月-9月书单： 1. 第七天（余华） 2. 解密（麦家） 3. 李诞脱口秀工作手册（李诞） 4. 假面饭店（东野圭吾） @便便咖啡 @JoannaZa 8月书单都忘发了，一起补上祝我们节日快乐 ,0,0,0,https://m.weibo.cn/detail/OzzpPgWyE,,2024-10-01 21:16:23
微博,洛杉矶的小妾,我闺蜜给李诞当了小妾了 ,0,0,0,https://m.weibo.cn/detail/Ozzp9kqKa,,2024-10-01 21:14:43
微博,諗绥,随着时间，每个人都会形成自己的语言风格，我对自己写的乱七八糟东西的风格定义为: 矫情逼风 李诞的播客还蛮不错，前几天听的第13期: “我的语言来自何处？”，感觉讲得挺好。 ,0,1,0,https://m.weibo.cn/detail/OzzmCq1MT,,2024-10-01 21:08:29
微博,逃跑特长生,非常不想特别恶心人的说，因为没有李诞所以不想看脱口秀了。 所以看了，每天下饭时候都会打开，但我吃饭的速度居然比不上他更新的速度。 哎，恶心就恶心吧，确实没有李诞在的时候好看。 ,0,0,0,https://m.weibo.cn/detail/Ozz0GmB8x,,2024-10-01 20:14:26
微博,俄亥俄Carolina,哈哈哈徐志胜是真的素材不够了感觉，把直播李诞地称呼都提了 ,0,0,0,https://m.weibo.cn/detail/OzyVwlwmM,,2024-10-01 20:01:43
微博,快吃饭睡觉w,#罗永浩 脱口秀悖论#真的很喜欢罗永浩的大局观 每一次给灯都拍到我的点上 我宣布 罗永浩 李诞 鲁豫 就是最懂脱口秀的三个人 ,0,3,4,https://m.weibo.cn/detail/OzyUSD16e,,2024-10-01 20:00:09
微博,你别说还真是这样,其实我觉得最好的脱口秀领笑员阵容是李诞、杨笠、鲁豫、大张伟，会把关会点评会聊天会鼓励支持。现在这几个节目就真的就跟评委一样，高高在上点评分析段子结构、价值分析、观众喜好什么… 还有罗永浩，看到好多repo都是在吐槽他爹味 ,22,34,873,https://m.weibo.cn/detail/Ozgs30thK,,2024-09-29 20:59:39
微博,阿绒毛茸茸,几年不看脱口秀了，怎么现在只剩王建国？？？池子和李诞嘞？？？是因为坐上头等舱就写不出好笑的段子了吗？？？ ,0,0,0,https://m.weibo.cn/detail/OzyMzdmfT,,2024-10-01 19:39:39
微博,不借天命逆苍生,夜店。都挺放荡的。#李诞说要送朋友真挚爱情#,0,0,0,https://m.weibo.cn/detail/OzyLClMnO,,2024-10-01 19:37:18
微博,居居心不轨,“毫无理由地爱狗狗”————————202410011917 在于它简单而纯粹的世界，在于它活在当下的每个瞬间，也能够心里有我、喜欢我。（刚好听到李诞的播客，狗狗世界的每个瞬间或许都能“enjoy”）最为关键的是——我可以轻松地喜爱它。不必思虑、不必负担，在这种轻松而简单的爱的关系中，照顾的责任是 ...全文,0,0,0,https://m.weibo.cn/detail/OzyDOCqZ6,,2024-10-01 19:18:06
微博,春田花花毕业生,难过的时候听听李诞的小卖部，很治愈，真的很感谢。 ,0,0,0,https://m.weibo.cn/detail/OzyqijV9B,,2024-10-01 18:44:47
微博,llllllllIIIIIIlllllllllll,李诞   我放不下的虾系男友（因为我还不知道内情，以为他是纯爱少年）渣了我之后，人生一路极速滑向深渊  现在我知道了他有多烂，看清了人的本质就是趋利避害，我再也不会为了情绪价值、氛围感、聊天聊得来这些虚幻的东西，就对一个虾系·普信·垃圾男 泥潭深陷  我会越来越好，就算他让我坠入深 ...全文,0,0,0,https://m.weibo.cn/detail/Ozyl6fS4O,,2024-10-01 18:31:59
微博,星冰乐kiki,李诞直播讲述股市大师段永平对自己的感触……祝大家找到热爱，并不痛苦的做下去。一直都觉得，世界上最幸运的事就是能找到自己热爱的事情，并努力下去，每一次的成就感都让自己很快乐。#A股疯涨普通人是否要入局# ,82,6,318,https://m.weibo.cn/detail/OzomfwACK,,2024-09-30 17:07:21
微博,Ohiohihi18,李诞  以前很看不上为了“跨阶级”拼命谄媚的人。后来忍不住还会提供个建议，以便亲眼目睹结局。再后来才知道这类人但凡能交心的都要沦为他们的台阶。一旦有机会狠狠踩踏上去。可这个判断能力都是要经历过后才知道，所以谁都没法避免。 ,0,0,0,https://m.weibo.cn/detail/OzxXR5JG0,,2024-10-01 17:34:43
微博,童话书里的熊酱,#范丞丞#    范丞丞在做家务的男人里，经过郭麒麟的简单教学，get了捧哏技能还被李诞夸赞有捧哏天赋 是人见人爱的范丞丞Adam0616 没错啦~ 童话书里的熊酱的微博视频 ,0,0,1,https://m.weibo.cn/detail/OzxHRc6L1,,2024-10-01 16:55:17
微博,果汁aaaa,每次跟gfy一起出去就会限时变成e人 两个人三分钟就能蛐蛐八个人。其言语刻薄程度令李诞听完会直接邀请我们进入笑果文化，郭敬明听完都跳起来给我们鼓掌👏 最后作为她的专职司机送她回家，不知道她说了什么导致视频里我笑的像只鸭子 ,0,2,4,https://m.weibo.cn/detail/Ozxty9d66,,2024-10-01 16:20:03
微博,7哩咕噜,李诞说：冥想就像你在火车站看着自己的情绪像火车一样来来往往。心里知道：“这些是情绪，它们会来，也会走。”  比喻的重要性！#生活手记# ,0,0,0,https://m.weibo.cn/detail/OzxjrnGN3,,2024-10-01 15:55:09
微博,花里也有宇宙,喜欢李诞的小卖部 他终于又出现了 喜欢听他说话  我不一定会百分百按照他说的去做  但是会让我有一种新思路  这让我又想起来很早以前看他说脱口秀  发「抄台词」的时候  太怀念了 希望李诞多多说话 ,0,0,1,https://m.weibo.cn/detail/Ozx2SdIFM,,2024-10-01 15:14:20
微博,大不列颠买不到水煎包,争议与否先不论，我很喜欢听李诞的播客。听他的内容会想到哦原来事情还可以从这个角度思考。这些一定是看了很多书，见了很多人之后沉淀出来的 ,0,1,0,https://m.weibo.cn/detail/OzwZa2vm2,,2024-10-01 15:05:11
微博,电影解密师,聊聊主持人喜剧之王单口季李诞  #综艺节目#  #脱口秀和ta的朋友们#           电影解密师的微博视频 ,0,0,0,https://m.weibo.cn/detail/OzwSu4xgx,,2024-10-01 14:48:44
微博,想去喜欢的面包店打工,喜欢听姜思达和李诞的博客！好喜欢！ ,0,0,0,https://m.weibo.cn/detail/OzwNkznj5,,2024-10-01 14:36:03
微博,livew1thecat,看李诞小卖部读信，每读完一封李诞就几乎立刻能反应出对方到底在想什么，好厉害…. ,0,0,0,https://m.weibo.cn/detail/OzwwQmoG1,,2024-10-01 13:55:26
微博,算盘和花花世界,一些琐碎 拥有了大量的通勤时间。有时候公交车，有时候开车。开车不能看电脑，公交车上看屏幕会恶心，况且打开笔记本也很诡异。于是同时拥有了大量的听世界的时间。 每个月一次爱上李诞，每周一次种草一本新书。三五不时遇到三联生活周刊聊我喜欢的话题。失去了郝雨的谐聊就像失去了空闲时间的我，努力 ...全文,0,1,1,https://m.weibo.cn/detail/OzwwjpwHT,,2024-10-01 13:54:07
微博,雪临i,24-10-01 📖笑场-李诞  夕阳非常重要，风也是。  人要多脆弱，才会宣告自己热爱某一样东西。  给人适应的时间，是上天的仁慈。 然后每次适应一点儿，就又衰老一点儿。上天仁慈有限。  于是我们相爱，手心湿的像海。 ,0,0,0,https://m.weibo.cn/detail/Ozww4E3qB,,2024-10-01 13:53:32
微博,不能再瘦辣,受不了了。。到现在我看当时杨蒙恩在脱上求婚那段还是会被感动 尤其是李诞和杨笠都在哭 我是真的受不了 ,0,0,0,https://m.weibo.cn/detail/Ozwv5qOGm,,2024-10-01 13:51:06
微博,不管喜和悲日落永远okk,跟爸妈一起听李诞播客也是搞笑 ,0,1,0,https://m.weibo.cn/detail/OzwoXaa6O,,2024-10-01 13:35:59
微博,海的那边是玉米地,又想起李诞的博客 如何活在真实世界中 是不是我早已跳进虚假牢笼 ,0,0,0,https://m.weibo.cn/detail/OzwnweDtr,,2024-10-01 13:32:27
微博,下雨天了怎么办_1,今天什么都不做，赖在床上听 李诞➕王建国的快乐是1加1大于2的…^_^ 最喜欢的两期 ,0,0,1,https://m.weibo.cn/detail/OzwangB3d,,2024-10-01 13:00:04
微博,用户7935363087,李诞 小卖部在哪里投稿？ ,0,0,0,https://m.weibo.cn/detail/Ozw6zcXCe,,2024-10-01 12:50:41
微博,夸克麟,还有个池子，也是笑果出来的，李诞家里挂东亚病夫牌匾，简直是蟑螂窝//@瑛兰傲雪:从卡姆到李昊石，再到今天的阿潘。脱口秀演员拿无知当个性，拿逆反到潮流，已经是到了病入膏肓的程度，甚至一些言论，几乎与反贼毫无差别，行业自身不净化，就别怪铁拳帮你们净化，都是自找的。,15,0,1,https://m.weibo.cn/detail/Ozw4Eouh7,,2024-10-01 12:45:57
微博,奈奈奈奈奈凉ice,人没有朋友会s掉吧 很爱昨晚认识的新朋友们 大学创业的亚比姐 贼亚贼猛 立誓要找个男人买birkin的0哥 so sweet 真的很开心感受大家不一样的生活方式 希望下次偶遇下李诞 去五花马也打卡下 ,0,0,0,https://m.weibo.cn/detail/Ozw3VqgV9,,2024-10-01 12:44:11
微博,长腮的游泳者,生存环境太过恶劣，即使变坏也在所难免！#李诞#人生#人生感悟#李诞语录#人生哲理# #人生# 长腮的游泳者的微博视频 ,0,0,0,https://m.weibo.cn/detail/OzvMWbHJG,,2024-10-01 12:02:20
微博,娱乐奇幻岛主,年轻时的选择或许总带点错觉，但那正是可以大胆尝试与犯错的年纪 #人生# #人生感悟# #李诞# #李诞语录# #李诞小卖部# #人生# 娱乐奇幻岛主的微博视频 ,0,0,0,https://m.weibo.cn/detail/OzvMGkUkF,,2024-10-01 12:01:42
微博,八卦工厂,感情的终点总是分离，只是早晚的问题#李诞# #李诞的小卖部# #李诞语录# #李诞直播# #李诞小卖部# #李诞# 八卦工厂的微博视频 ,0,0,0,https://m.weibo.cn/detail/OzvMxxlaW,,2024-10-01 12:01:20
微博,凌晨四点我看见海棠花未眠H,李诞  小北 算了有算了的道理 橘子不是唯一的水果 ,0,0,0,https://m.weibo.cn/detail/OzvEJcB0q,,2024-10-01 11:42:06
微博,麻辣烫加麻酱麻麻辣辣,李诞小卖部也太众生相了，太可乐了。今天学到一句:沉没成本不参与决策。妈呀，大智慧 ,0,0,0,https://m.weibo.cn/detail/OzvrVEStc,,2024-10-01 11:10:35
微博,是财神宠爱的小张阿,刷到好多单口喜剧和脱友决赛的repo 这么快又录完啦 都说现场特别好看 呼兰也是哈哈哈哈因为股票涨了 把之前的稿子换了重写的 李诞说这几年就没见过他那么兴奋有底气的样子哈哈哈 ,0,2,1,https://m.weibo.cn/detail/Ozvo6egXD,,2024-10-01 11:01:07
微博,春桃崽崽,李诞是一个很妙的人。 ,0,0,0,https://m.weibo.cn/detail/OzvnYdn5v,,2024-10-01 11:00:49
微博,2024快乐健康,最近好喜欢王慧玲和李诞 洗漱视频必备😛 ,0,0,0,https://m.weibo.cn/detail/Ozvgmjilb,,2024-10-01 10:42:04
微博,别烦我gun闹心,李诞小卖部生活良药💊  洒脱、清醒又通透 ,0,0,0,https://m.weibo.cn/detail/Ozuc84oO9,,2024-10-01 07:58:54
微博,我一介小小文科生,李诞 十月顺利 ,0,0,0,https://m.weibo.cn/detail/OzuaxEcMu,,2024-10-01 07:55:00
