微博id,微博bid,微博作者,发布时间,微博内容,转发数,评论数,点赞数,国家,省份,城市,用户简介,用户关注数,粉丝数,性别,主页,url,uni_id
5168295172899174,PsEFvcacS,万里桐花开,2025-05-20 08:30:54,18岁女演员黄杨钿甜压根儿没想到自己成人礼上戴了一对耳环，会把亲爹送进了中央巡视组的举报名单。#热点观点# 5月18日凌晨，有网友晒出实名举报截图，把曾任四川雅安某局黄父问题材料直接捅到了中央巡视组，这一下把原本在娱乐圈小范围传的230万耳环风波彻底闹成了公共反腐事件。当网友扒出黄家在深圳 ...全文,1,3,5,中国,山西,长治,“桐花万里丹山路，雏凤清于老凤声。”一起品读不一样的历史！,630,22.8万,女,https://weibo.com/u/7630253269,https://m.weibo.cn/detail/PsEFvcacS,PsEFvcacS
5168012642488962,PsxjOaruy,郝努力,2025-05-19 13:48:14,虞书欣戴1200万项链没人怀疑。可黄杨钿甜戴230万耳环就引起民愤。不是因为他们的家底悬殊，而是网友都不知道她家怎么发家的。虞书欣是什么人？演艺圈的小公主。没进圈家境显赫跟王思聪玩在一起的人，走红毯用的多少百万级别，千万级别的珠宝都是她自己的。可是黄杨钿甜一直都是走的草根人设 ...全文,23,40,132,中国,山西,太原,不忘初心，方得始终,158,51.5万,女,https://weibo.com/u/5319374414,https://m.weibo.cn/detail/PsxjOaruy,PsxjOaruy
5168281782585229,PsEjUaQxf,lakestopstop,2025-05-20 07:37:42,#不是黄杨钿甜都不知道啥是火彩#前两天董小姐的事情微博天天挂，知乎也天天挂，董小姐一众亲友全都被扒出来，有名有姓有职位有履历，最后官方下场盖棺定论。。。耳环事情微博挂了好多天，知乎几乎不见讨论，像样的有凭有据的深度分析也没有，父母职位履历经手项目金额也没找出来，求锤没得锤。。。这瓜 ...全文,0,0,6,中国,四川,成都,带娃的职业建筑师,22,100,女,https://weibo.com/u/5703210282,https://m.weibo.cn/detail/PsEjUaQxf,PsEjUaQxf
5168280874780638,PsEirk3F4,狐狸耶熬夜睡觉,2025-05-20 07:34:05,表面用一千块手机，澄清230万耳环是假的，暗地里商业奇才，一下海就成亿万富翁。黄杨钿甜父亲决心来波大义灭亲。老父亲这边忙着撇清关系，凌晨连夜改公司法人。吓到阻断女儿高奢路，想到耳环是高仿的。黄杨钿甜却强调是她妈妈的，只有嘉行淡定淡定借品牌的。众口不一都自认为是最好的 “答案”，结果 ...全文,0,1,4,中国,广东,汕头,名字好矛盾的一个人,1024,1.2万,男,https://weibo.com/u/7854395569,https://m.weibo.cn/detail/PsEirk3F4,PsEirk3F4
5168169624013651,PsBp0gQ8j,娱乐顺风车,2025-05-20 00:12:01,杨幂啊杨幂，你糊涂啊，为什么要为了一个小演员去趟浑水呢？你又不靠黄杨钿甜赚钱，黄杨钿甜这个天价耳环不管是不是真的都对你杨幂没好处呀，难道因为你的公司发生了，黄杨钿甜能认可你了，帮你努力赚钱吗？她这种娱乐圈的小透明太多了，比她长得好看，气质比她好的那么多呢，不一定能给你赚到钱，也不 ...全文,0,9,36,中国,湖南,N/A,专注正能量娱乐博主，图片及视频的素材均来源于网络，如有侵权，引战请立即联系博主删帖，谢谢!,439,1.4万,男,https://weibo.com/u/7944872164,https://m.weibo.cn/detail/PsBp0gQ8j,PsBp0gQ8j
5168189841605115,PsBVC6JyX,易月生_,2025-05-20 01:32:21,#不是黄杨钿甜都不知道啥是火彩#因为黄杨钿甜广大网友才知道什么叫珠宝的火彩。也算是有效科普了，让穷人明白宝石真的是闪闪发光的，一点没有夸张。所以这个耳环怎么会是假的呢不过也有网友呼吁不要转移话题也不该娱乐化此事，还是等官方的调查结果吧#黄杨钿甜# ,0,4,16,中国,北京,北京,合作请私信^_^,2689,1.5万,女,https://weibo.com/u/6089075311,https://m.weibo.cn/detail/PsBVC6JyX,PsBVC6JyX
5168040481132427,Psy2I4KAX,妍如其茗,2025-05-19 15:38:51,#耳环是找妈妈的#黄杨钿甜:盛世为何唱哀歌？相关部门都介入了，安心等待调查结果不行了，逮着一个小女孩一直薅，就离谱~ 妍如其茗的微博视频 ,4,38,93,中国,四川,雅安,娱乐八卦，影视花絮，军事动漫，社会热点，全方位报道，承接推广！,4657,8.3万,女,https://weibo.com/u/7766034989,https://m.weibo.cn/detail/Psy2I4KAX,Psy2I4KAX
5168175067959114,PsBxMxowO,态度岛,2025-05-20 00:33:39,【拔出萝卜带出泥：黄杨钿甜230万耳环又牵出大瓜，张颂文赵丽颖被牵连其中】最近，有着“小赵丽颖”称号的女演员黄杨钿甜因为18岁成人礼，导致星途尽毁。甚至还将他们一家人推上了风口浪尖。（原文链接拔出萝卜带出泥！230万耳环又牵出大瓜，张颂文赵丽颖被牵连其中）在其成人礼上，她特意戴了一对与衣服颜色相配的耳环，似乎是为了炫耀，她特 ...全文,2,2,5,中国,山东,青岛,力争做一个合格的信息传播者,469,72.3万,男,https://weibo.com/u/1199581807,https://m.weibo.cn/detail/PsBxMxowO,PsBxMxowO
5168173495882273,PsBvfoGfn,相思不愿相思,2025-05-20 00:27:24,#耳环是找妈妈的#我去你大爷的🍠玩不起，明明那两分钟分钟暴涨的点赞量和评论量，妈的下一秒我这条评论之下的所有评论直接一瞬间消失了惹毛我了黄杨钿甜请滚出娱乐圈#耳环##记录生活记录爱##耳环姐##黄杨钿甜爸爸 雅安公务员# ,2,0,7,老挝,老挝,N/A,,592,11,女,https://weibo.com/u/6978508150,https://m.weibo.cn/detail/PsBvfoGfn,PsBvfoGfn
5168168856192967,PsBnLpZ4z,小段剧,2025-05-20 00:08:58,你们肯定想不到，我有个富二代客户跟我说了些特别有意思的事儿。他们那个圈子，兜里有钱那是真不缺，别说买个230万的耳环，就算1000万的，眼睛都不眨一下。但他们最不喜欢的，就是到处显摆。像黄杨钿甜这样的，在他们眼里就特别“扎眼”。有点好东西就赶紧晒出来，一副暴发户的样子。真正在那个圈 ...全文,28,35,81,中国,浙江,台州,投稿请私信,122,19.6万,男,https://weibo.com/u/6081498548,https://m.weibo.cn/detail/PsBnLpZ4z,PsBnLpZ4z
5168150753843968,PsAUzg7Zu,阳宝_V,2025-05-19 22:57:02,扯着藤，连着瓜！最近黄杨钿甜的耳环事件，成了新晋未解之谜，接着虞书欣又被起底父母疑似曾参与诈骗公司，娱乐圈富二代成了主力军，一边炫富一边捞金，最卑微的还是观众。#虞书欣爸爸维权声明# ,0,0,2,中国,安徽,合肥,一些真实的三观🫰🏻,360,2.6万,女,https://weibo.com/u/2503532933,https://m.weibo.cn/detail/PsAUzg7Zu,PsAUzg7Zu
5167856188654061,PstfsAjjD,老特拉福德的糖猫儿,2025-05-19 03:26:32,#黄杨钿甜同款耳环仿款售价不到百元#666，说多了吧，拼夕夕同框黄杨钿甜耳环只要9.95你们这个洗地方式是说黄杨钿甜一个女明星，在自己的十八岁成人礼上，特地从妈妈那里挑了个不到百元的假货耳环，并且带着大秀特秀，还为假货耳环拍了视频和照片，，而且好几张自拍都超 ...全文,23,122,1694,中国,江苏,南通,曼联球迷，猫咪控,1346,237.8万,女,https://weibo.com/u/1762789510,https://m.weibo.cn/detail/PstfsAjjD,PstfsAjjD
5168142952960114,PsAHZcq3M,俏皮桃子在打坐,2025-05-19 22:26:02,家人们，最近黄杨钿甜可是被推上了风口浪尖，大家都在讨论她是不是又一个“特权天龙人”。事情起因是她晒成人礼照片，佩戴的耳环被指价值230万。这可把网友惊到了，一个年轻演员咋能消费得起这么贵的东西？随着深挖，她父亲杨伟曾是雅安公务员，2017年才辞职经商，这资本积累速度让人怀疑。而且她母 ...全文,0,2,3,中国,山东,泰安,每天分享新鲜事， 感谢你的观看， 谢谢你关注我。,304,46,女,https://weibo.com/u/5970837221,https://m.weibo.cn/detail/PsAHZcq3M,PsAHZcq3M
5168115874270089,PsA0jhUQp,虎妞的篱笆墙,2025-05-19 20:38:26,#黄杨钿甜爸爸刚从一生物公司退出#这个黄杨应该没有什么拿得出手的影视作品，她在演艺圈或者娱乐圈才刚刚起步吧，结果因为一对耳环，祖宗几代都快出名了，这个名气真的是来得猝不及防啊。 风波持续了这么一段时间都还没平息。就算是他家没事，这姑娘在圈内也举步维艰了。 ,0,4,18,中国,福建,三明,爱好电影 关注儿童权益 记录生活 努力练级,242,3.4万,女,https://weibo.com/u/1150503407,https://m.weibo.cn/detail/PsA0jhUQp,PsA0jhUQp
5168072047726570,PsyRCwq26,韩涵-萌萌哒,2025-05-19 17:44:17,#黄杨钿甜耳环争议#先简单介绍下黄杨钿甜，17岁黄杨钿甜，在娱乐圈内有「小赵丽颖」之称，她2007年出生在深圳，2017年，年仅10岁的她因出演《楚乔传》里的小楚乔正式进入演艺圈，后来又在《如懿传》里演小如懿，这几年陆陆续续演了不少热门影视剧，也算童星里崭露头角的一位了。 ,0,0,13,中国,山东,菏泽,欢迎互动互粉,505,11.9万,女,https://weibo.com/u/2013208433,https://m.weibo.cn/detail/PsyRCwq26,PsyRCwq26
5168113194374756,PszVZim4A,追剧-,2025-05-19 20:27:47,谁能想到，两个长相相似的00后小花，会因为一条项链的细节被推上热搜？最近有网友发现，艾米在《仙台有树》片场自拍时突然慌张摘项链，仔细一看才发现——三万的项链在两百多万的耳环面前瑟瑟发抖，这届网友真是显微镜追星啊！说起艾米，老追剧人应该记得她这些年堪称“娱乐圈打工人实录”。...全文,36,21,38,中国,河北,邢台,蜗牛快跑,323,2.5万,女,https://weibo.com/u/5037842556,https://m.weibo.cn/detail/PszVZim4A,PszVZim4A
5168080352449404,Psz51ahcw,直到黑夜将你降临,2025-05-19 18:17:17,#耳环是找妈妈的#黄杨钿甜“耳环是找妈妈的”事件源于她在2025年5月11日发布的一组成人礼照片，因佩戴一对疑似价值230万元的祖母绿钻石耳环引发舆论风波。该事件从娱乐话题演变为社会性争议，核心涉及家庭财产合法性、公务员廉洁性及娱乐圈资源公平性等问题。以下是事件的关键脉络与分析：事件背景与 ...全文,0,7,1,中国,江苏,苏州,我是gay       |𖦹‎.𖦹‎    不要直fo看到会直接移除！o_O,427,1万,女,https://weibo.com/u/7758998428,https://m.weibo.cn/detail/Psz51ahcw,Psz51ahcw
5168079584888242,Psz3MkvEC,全娱乐剧场,2025-05-19 18:14:14,#黄杨钿甜两年前的项链##黄杨钿甜的耳环是成套卖的# 珠宝界“高定传说”！黄杨钿甜两年前戴的项链耳环价值2000w，这波配置直接封神，不愧是内娱富贵花！#耳环是找妈妈的# ,0,0,9,中国,山西,忻州,,261,40.2万,女,https://weibo.com/u/6310279370,https://m.weibo.cn/detail/Psz3MkvEC,Psz3MkvEC
5168070995217697,PsyPVlTmp,综艺崽崽酱,2025-05-19 17:40:06,#耳环是找妈妈的#黄杨钿甜这件事不管是真是假都不好玩梗吧，过度娱乐化总觉得不是件好事情…感觉包括黄杨钿甜在内，很多明星出事好像都是因为秀一些东西被扒出了蛛丝马迹，财不外露，老一辈的话还是有道理的。黄杨父亲的发文澄清后，黄杨以后估计都不能接高奢代言了… ,5,28,304,中国,山东,菏泽,合作wx:zu030528,1055,115.1万,男,https://weibo.com/u/6378160135,https://m.weibo.cn/detail/PsyPVlTmp,PsyPVlTmp
5168067719468174,PsyKDDJ6u,有一杯苦瓜汤,2025-05-19 17:27:05,#耳环是找妈妈的#2025年5月，新生代演员黄杨钿甜因在成人礼照片中佩戴疑似价值230万元的祖母绿钻石耳环，并标注“耳环是找妈妈的”引发舆论风暴。这场风波从奢侈品讨论演变为对其家庭背景的全面审视，涉及公务员资产合法性、娱乐圈资源分配等深层社会议题 ,0,0,1,中国,山东,N/A,solo,73,41,男,https://weibo.com/u/7447025998,https://m.weibo.cn/detail/PsyKDDJ6u,PsyKDDJ6u
5168062971251425,PsyCZ5fyh,追剧少女琪琪,2025-05-19 17:08:13,娱乐#耳环是找妈妈的#黄杨钿甜翻大车了她做的最错的事儿，不是戴着耳环炫富而是在社交平台说了这句话:耳环是找妈妈的!这个找字用的真的很妙，不是借，不是拿，而是找暗戳戳地说明了她妈妈像这种档次的耳环首饰绝对不止一个意思就是“我妈有一堆这种耳环哦，我只是随便找出一副230万 ...全文,0,0,0,中国,安徽,六安,,1527,352.3万,男,https://weibo.com/u/1644037223,https://m.weibo.cn/detail/PsyCZ5fyh,PsyCZ5fyh
5168062098574487,PsyBzzYCb,当红娱乐学姐,2025-05-19 17:04:45,娱乐#耳环是找妈妈的#你不觉得黄杨钿甜那句“耳环是找妈妈的！”这句话很有深意吗？我表示满脸疑惑，问她为啥这么说？她说，我觉得这里面最少有三层意思，你想，她要参加成人礼，这么重要的场合，首饰什么的肯定不可能随便选，就算是她自己想不到，她妈妈应该也不能想不到。如果是她不 ...全文,0,0,1,中国,安徽,六安,风好大，吹乱了我的秀发，吹落了你的假发。,1629,395.2万,男,https://weibo.com/u/2642705295,https://m.weibo.cn/detail/PsyBzzYCb,PsyBzzYCb
5168060752726612,PsyzpbrjC,内娱男神齐公子,2025-05-19 16:59:24,娱乐#耳环是找妈妈的#黄杨钿甜发文说耳环是找妈妈的，这个“找”字，可以有以下三层意思：第一层：黄杨钿甜在她妈妈一堆亮晶晶中，找出这对和她眼缘的耳环。第二层：黄杨钿甜很重视这次成人礼，主动告知妈妈并要一对耳环，她妈妈也觉得这是重要的场合，所以选了这一对耳环。第三层：黄杨 ...全文,0,1,0,中国,安徽,六安,,2267,392.3万,女,https://weibo.com/u/1210027292,https://m.weibo.cn/detail/PsyzpbrjC,PsyzpbrjC
5168043711268739,Psy7V5k3x,月亮小困包,2025-05-19 15:51:41,#耳环是找妈妈的#黄杨钿甜的咖位不算大，顶多算个小演员，如果这宝石不是真的，那她没必要像没见过世面一样，特意把耳环拿出来说事！这种行为就像在暗戳戳的表示，虽然我演戏比不过你们，但是家庭实力这方面，你们还差着辈儿呢！因为像这种高定系列，咱们普通人就看个乐呵，只有圈内人才能懂黄杨钿 ...全文,0,9,36,中国,广东,惠州,我负责发，你负责点赞,3251,12.1万,女,https://weibo.com/u/7518900791,https://m.weibo.cn/detail/Psy7V5k3x,Psy7V5k3x
5168053165754808,Psynao95u,小宝快过来520,2025-05-19 16:29:15,#耳环是找妈妈的#      黄杨钿甜“耳环是找妈妈的”事件源于她在2025年5月11日发布的一组成人礼照片，因佩戴一对疑似价值230万元的祖母绿钻石耳环引发舆论风波。该事件从娱乐话题演变为社会性争议，核心涉及家庭财产合法性、公务员廉洁性及娱乐圈资源公平性等问题。      耳环到底是不是假的了  可能 ...全文,0,0,3,中国,上海,上海,,145,26,男,https://weibo.com/u/2105564821,https://m.weibo.cn/detail/Psynao95u,Psynao95u
