微博id,微博bid,微博作者,发布时间,微博内容,转发数,评论数,点赞数,国家,省份,城市,用户简介,用户关注数,粉丝数,性别,主页,url,uni_id
5120324314863210,P8wJ9kp8S,铁军小子,2025-01-07 23:31:50,友情提示：请广大网友擦亮眼睛，千万不要被近期的”谣言“所带偏。千万不要被恶意的谣言带了负能量节奏，好演员我们必须拥护。针对一些下三滥 落井下石的我们也要积极举报予以打击。以下是张颂文曾演讲的【《扎根》：终究有一天，我们会变成一棵参天大树。】 铁军小子的微博视频 ,11,12,238,中国,北京,北京,最快，最全，最有料的资讯号！😎️,3088,37万,男,https://weibo.com/u/5848272985,https://m.weibo.cn/detail/P8wJ9kp8S,P8wJ9kp8S
5120902302271368,P8LLo9wSY,非非马UK,2025-01-09 13:48:33,张颂文事件又有4项关键进展，匿名爆料人已注销微博账户，并发布道歉声明，承认自己全是道听途说。这场沸沸扬扬的舆论事件背后，更有媒介伦理与法律思维两大重要问题值得深思。#微博新知##张颂文#张颂文#日挂中天声明# 非非马UK的微博视频 ,62,70,740,英国,英国,N/A,,335,8.4万,女,https://weibo.com/u/2706951095,https://m.weibo.cn/detail/P8LLo9wSY,P8LLo9wSY
5120894580296320,P8LyW1f5m,阿臻杂谈,2025-01-09 13:17:52,阴霾正在逐步散去，关于张颂文老师，大家请静候佳音。#张颂文 #张颂文事件始末 #在心里点灯的人张颂文 #狂飙张颂文 阿臻杂谈的微博视频 ,20,42,499,中国,北京,北京,孤身走夜巷，只为心里的光。 我就是我，颜色不一样的，柴火… 脱稿口播，即兴评述。 没文案、没文案、没文案。,289,3300,男,https://weibo.com/u/7691374694,https://m.weibo.cn/detail/P8LyW1f5m,P8LyW1f5m
5120850737498748,P8KqdvsLy,麻烦了__怎么办,2025-01-09 10:23:39,#张颂文# 哥很棒！文竹很棒！ 视频源dy58716626153（侵删） 麻烦了__怎么办的微博视频 ,44,101,804,中国,吉林,长春,​🧸🐾我个人很喜欢你，麻烦了__怎么办？,663,820,男,https://weibo.com/u/7823689753,https://m.weibo.cn/detail/P8KqdvsLy,P8KqdvsLy
5121011613434951,P8OBHepAr,赵瞾说事,2025-01-09 21:02:55,张颂文这波舆论战打得漂亮，赢得很彻底，他要好好谢谢三个人：  首先得谢谢姜尘，她这一闹，又是家暴又是性侵的，把大家的注意力全吸引了过去，正好让张颂文从《清明上河图密码》的演技争议中脱身，我都怀疑他俩是不是商量好的。  其次，得感谢他的老婆，家里出了这么大的事，她得承受多大的压力，这个 ...全文,0,4,37,中国,辽宁,沈阳,商务合作：＋V：850045844（网页版互动不回！！！）,3846,53.8万,男,https://weibo.com/u/5934541885,https://m.weibo.cn/detail/P8OBHepAr,P8OBHepAr
5120996453387735,P8OdfediT,江苏卫视,2025-01-09 20:02:40,#江苏卫视清明上河图密码##清明上河图密码# 张择端如实画下来赵家人的生活，赵不尤希望他的画流芳百世，后人也从画里认识他们一家五口人。@张颂文 @是安 江苏卫视的微博视频 ,1,66,29,中国,江苏,南京,有品质有温度只引领不跟随,503,939.1万,男,https://weibo.com/u/1575527140,https://m.weibo.cn/detail/P8OdfediT,P8OdfediT
5121046120501528,P8Pvm26ta,Baby小坏熊_小宜,2025-01-09 23:20:02,张颂文| 250104 | 澳门星光大赏  紫色真的很合适你  紫气东来  大红大紫    紫薯丸zsw@张颂文 ,18,30,95,中国,广东,N/A,溺爱老宝宝,346,1910,女,https://weibo.com/u/1739120193,https://m.weibo.cn/detail/P8Pvm26ta,P8Pvm26ta
5120917036074956,P8M99puna,快乐张小熊,2025-01-09 14:47:06,张颂文 这次风波提现了张颂文老师的大智慧，一个人遇到事都应冷静处理不能意气用事，即便胸有成竹也不能打乱阵脚，与恶人对骂争辩只会陷入无休止的争斗，对方就是要达到这个目的，是想那个剧组敢用纷争不断的演绎，就像埋了一颗地雷，形成隐患？现在风波基本平息，恢复宁静让张颂文安心拍戏才 ...全文,11,41,311,中国,河南,郑州,教书育人是我的职业，观摩影视作品是我的爱好，最喜欢的演员一生追过的明星就是张颂文。,84,426,女,https://weibo.com/u/5123394397,https://m.weibo.cn/detail/P8M99puna,P8M99puna
5120871721863400,P8KY47OKQ,嗑学君,2025-01-09 11:47:02,我只相信张颂文身边素人说的话~ ,108,176,1524,中国,河南,郑州,跑的没有粉丝快，当什么YXH。QQ:622123 威信:622123,1657,42.9万,女,https://weibo.com/u/1901459883,https://m.weibo.cn/detail/P8KY47OKQ,P8KY47OKQ
5120964705388659,P8No2mBPR,三花虾,2025-01-09 17:56:31,张颂文 鼠黑仔买我浩子干啥？表演脱了回踩的戏码吗？然后带节奏扇动粉丝情绪内豆？？我可不是评论区那个钻二，永远支持老师，永远不会卖浩子，就算你全家脱肛了我都不会脱粉，，发出来大家警惕！！～ ,8,187,417,中国,辽宁,锦州,为颂文老师而来！！！,496,1391,女,https://weibo.com/u/7834659216,https://m.weibo.cn/detail/P8No2mBPR,P8No2mBPR
5120876780192960,P8L6e0Ocg,静枫纸鸢,2025-01-09 12:07:08,#姜尘晒录音提张颂文名字##张颂文#  小作文看多了，有个常规套路还是要了解。 就是如果有证据，直接丢证据，石锤了再去聊别的有的没的，这是痛打落水狗。 人民群众喜闻乐见。 早就看他不爽了。 没证据，但是声音很大，热搜很多，然后隔三岔五来一个，听说他又偷人白菜了，听说他随地吐痰了，听说他背后 ...全文,13,25,138,中国,湖北,N/A,时间像电影里火车喷出的烟，化成长长的龙，把一个个生命带去另一个地方,1757,30.9万,男,https://weibo.com/u/1863746943,https://m.weibo.cn/detail/P8L6e0Ocg,P8L6e0Ocg
5120930369506672,P8MuEDT7q,纽太普同学,2025-01-09 15:40:05,看到一个黄网上的标题（不要问我哪里可以看黄网）：“姜尘疑受境外势力收买，陷害国家级演员张颂文，不雅视频疯传”。  一个非常、非常经典的标题。 ,18,30,393,中国,上海,上海,气氛上多少是个作家（有证的那种）。国家二级脑洞师。最喜欢做的事情是和老婆孩子狗在飘窗上打滚。,1538,37.7万,男,https://weibo.com/u/1645599505,https://m.weibo.cn/detail/P8MuEDT7q,P8MuEDT7q
5121089590002529,P8QDt00EN,猫咪祉丞,2025-01-10 02:12:46,鱿鱼游戏吴京张颂文不回应曝顶流曾把女友藏行李箱偷摸见面被家暴16次女子直播带货声生不息传古法匠心香承胡姬花王慧玲封号胖东来公布员工结婚执行标准孙颖莎周边王楚钦和许昕儿子合照宋雨琦首个内娱红毯孙颖莎代言迪丽热巴今日chill一下广东女子错买断肠草煲汤致中毒身亡田亮我相信我的小棉袄会越来越 ...全文,0,6,6,中国,山东,淄博,幸福幸福请降临祉丞博文手心👐🏻,1023,1541,女,https://weibo.com/u/7936461043,https://m.weibo.cn/detail/P8QDt00EN,P8QDt00EN
5121089558546262,P8QDpzRgW,嘉文sz,2025-01-10 02:12:38,张颂文 选一条自己想走的路！ ,0,0,0,中国,河北,N/A,野生文竹，任何言论自行负责，与他人无关。,96,42,女,https://weibo.com/u/7751759889,https://m.weibo.cn/detail/P8QDpzRgW,P8QDpzRgW
5121089551993189,P8QDp8mwd,情短戏长琼瑶梦,2025-01-10 02:12:37,#狂飙# #张颂文# #高叶#   看似随随便便的几句闲聊，安欣早已看穿了老默的掩饰 情短戏长琼瑶梦的微博视频 ,0,0,0,中国,天津,天津,琼瑶剧，怀旧版,179,37.3万,女,https://weibo.com/u/6579089060,https://m.weibo.cn/detail/P8QDp8mwd,P8QDp8mwd
5121088835551655,P8QCfnieP,猫兔塑大王,2025-01-10 02:09:46,调音台不是DJ台😅调音台不是DJ台 调音台不是DJ台🤣调音台不是DJ台 调音台不是DJ台🥺调音台不是DJ台 王星弟弟已与其通视频电话 工作人员放马天宇李明德片场照 马天宇三人行路透 微博之夜 内娱提前过年 毁掉一个家庭只需要三分钟  姑娘往北走🎈🎈，小生往南瞧🎊🎊，自此不再打扰👍👍， ...全文,0,0,0,中国,辽宁,阜新,就是喜欢可爱小猫怎么了,867,1.5万,女,https://weibo.com/u/7441667597,https://m.weibo.cn/detail/P8QCfnieP,P8QCfnieP
5121088098929020,P8QB3BsQs,噜噜小猫脸,2025-01-10 02:06:50,调音台不是DJ台😅调音台不是DJ台 调音台不是DJ台🤣调音台不是DJ台 调音台不是DJ台🥺调音台不是DJ台 王星弟弟已与其通视频电话 工作人员放马天宇李明德片场照 马天宇三人行路透 微博之夜 内娱提前过年 毁掉一个家庭只需要三分钟  姑娘往北走🎈🎈，小生往南瞧🎊🎊，自此不再打扰👍👍， ...全文,0,0,0,中国,湖北,孝感,🔝宋亚轩 刘耀文,874,1.1万,男,https://weibo.com/u/7538122709,https://m.weibo.cn/detail/P8QB3BsQs,P8QB3BsQs
5121087583027335,P8QAecHxZ,搞笑梗主,2025-01-10 02:04:47,女演员姜尘自曝遭前任家暴，该前任表面温文尔雅、自称老师，实则情绪冷酷。他是广东人，经纪人为香港人。原生家庭不幸，无母亲陪伴。曾只身北漂，初期事业不顺。其对外形象稳定，但私下性格与公众角色相符，引发外界猜测。因细节与张颂文相似，导致其粉丝要求姜尘澄清。 ,0,11,13,中国,浙江,金华,,78,4.7万,女,https://weibo.com/u/7866747566,https://m.weibo.cn/detail/P8QAecHxZ,P8QAecHxZ
5121087433868199,P8QzZgeij,用户7974308337,2025-01-10 02:04:12,可能这就是天意 让张颂文火这一次 把他做过的事情曝光 如果他一直糊着 那他做过的这些事就无人知晓 因果轮回@舒舒-舒不了 @李晟Su @姜尘 #姜尘晒录音提张颂文名字##李子锋曝姜尘说李晟也被打# ,0,1,0,中国,北京,北京,,0,1,男,https://weibo.com/u/7974308337,https://m.weibo.cn/detail/P8QzZgeij,P8QzZgeij
5121087225200669,P8QzElOVL,我重生了这一次我将夺回一切,2025-01-10 02:03:21,谁投诉我？禁言到哪里了张颂文粉丝应该教15万学费给我 ,0,0,0,加拿大,加拿大,N/A,,20,2,女,https://weibo.com/u/7940122783,https://m.weibo.cn/detail/P8QzElOVL,P8QzElOVL
5121086650319464,P8QyJ1l6E,星闻大放送,2025-01-10 02:01:05,张颂文风波后首次露面，微笑温暖了粉丝的心！得到导演力挺，家暴传闻依旧成谜 #张颂文# #导演# 星闻大放送的微博视频 ,0,0,0,中国,北京,北京,韩星和韩星的一切,228,27.4万,女,https://weibo.com/u/6183820910,https://m.weibo.cn/detail/P8QyJ1l6E,P8QyJ1l6E
5121086598940670,P8QyDBvSm,--水木清华--,2025-01-10 02:00:53,张颂文   深夜翻你的博客，我似乎很难用语言去描述这是什么样的状态。可能就像夏日，坐在湖边的长椅上，闭着眼，仰着头听树叶梭梭作响的声音那样的感觉。 截取了几篇，有大家想听的声音，也有他隔了十多年，从那时候传来的想对大家说的话。 “小时候，我认为我需要很多人的爱，长大了才发现， ...全文,0,0,1,中国,北京,北京,我不做懒人，不做洋人，我只想做懒洋洋的人。——张颂文,199,270,女,https://weibo.com/u/3757304064,https://m.weibo.cn/detail/P8QyDBvSm,P8QyDBvSm
5121086523965992,P8QywgDJC,韩剧放映室,2025-01-10 02:00:35,世事如戏，无奇不有！妻子偶然遇见夫君，竟与另一位女子一同游览胭脂香坊。#清明上河图密码# #张颂文# #人生如戏# 韩剧放映室的微博视频 ,0,0,0,中国,北京,北京,给我分享点韩剧韩综吧,165,21.6万,女,https://weibo.com/u/6605419338,https://m.weibo.cn/detail/P8QywgDJC,P8QywgDJC
5121086134683350,P8QxTjElU,猫咪祉丞,2025-01-10 01:59:02,鱿鱼游戏吴京张颂文不回应曝顶流曾把女友藏行李箱偷摸见面被家暴16次女子直播带货声生不息传古法匠心香承胡姬花王慧玲封号胖东来公布员工结婚执行标准孙颖莎周边王楚钦和许昕儿子合照宋雨琦首个内娱红毯孙颖莎代言迪丽热巴今日chill一下广东女子错买断肠草煲汤致中毒身亡田亮我相信我的小棉袄会越来越 ...全文,0,5,5,中国,山东,淄博,幸福幸福请降临祉丞博文手心👐🏻,1023,1541,女,https://weibo.com/u/7936461043,https://m.weibo.cn/detail/P8QxTjElU,P8QxTjElU
5121086070456621,P8QxN1UMR,你有小哼吗,2025-01-10 01:58:47,李明德爆料马天宇片场耍大牌，没想到……  马天宇和工作室直接发声明回应，毫不留情！  导演组也出来辟谣了，指责他屡次迟到，打砸酒店等怪异行为。  同剧组的廖慧佳也发文力挺导演和马天宇。  没想到李明德直接开直播讲述了他是如何被踢出剧组的。  还顺带爆料了一大堆明星，包括张颂文、丁禹兮、虞书 ...全文,0,0,1,中国,重庆,重庆,镇魂丨ʚɞ,696,3678,女,https://weibo.com/u/6295853618,https://m.weibo.cn/detail/P8QxN1UMR,P8QxN1UMR
5121083885225330,P8QuglVlw,猫尾極刊_,2025-01-10 01:50:06,马天宇李明德发生什么了 李明德张颂文咋了 问古剑奇谭到底要塌多少次李明德床照为啥说小寒胜大寒 李明德涨粉 徐梦洁打开微博天塌了 马天宇回应李明德评论 凑个热闹 ,0,0,1,中国,上海,上海,爱本质无疑,203,1.6万,女,https://weibo.com/u/7831057138,https://m.weibo.cn/detail/P8QuglVlw,P8QuglVlw
5121083685208756,P8QtWlR2c,团子超能吃啦_,2025-01-10 01:49:18,快哉！快哉啊！哈哈哈哈！不知是怎样的三世情缘才让小生又遇到了姑娘 今夜月光正好 如果能与姑娘月下练剑倒也不负恩泽 哎！姑娘小心！刀剑无眼小心伤了姑娘！呵呵呵小生的爱好就是观察人类啊，，快哉快哉，小生看似热烈实则心如寒霜，不知哪位姑娘有此大爱，能穿越万千人海……呵呵，，，，不，，小生 ...全文,0,0,0,中国,广西,玉林,“今生今世与你相识歪瑞值🖤💛”,1394,1203,女,https://weibo.com/u/7843016382,https://m.weibo.cn/detail/P8QtWlR2c,P8QtWlR2c
5121083643004214,P8QtScBx4,舞出律动,2025-01-10 01:49:08,#张颂文# 钟情于你，眉心的炽热情感。 舞出律动的微博视频 ,0,0,0,中国,北京,北京,娱乐先锋资讯～,83,17.7万,女,https://weibo.com/u/6063043176,https://m.weibo.cn/detail/P8QtScBx4,P8QtScBx4
5121082967459118,P8QsMvism,噜噜小猫脸,2025-01-10 01:46:27,调音台不是DJ台😅调音台不是DJ台 调音台不是DJ台🤣调音台不是DJ台 调音台不是DJ台🥺调音台不是DJ台 王星弟弟已与其通视频电话 工作人员放马天宇李明德片场照 马天宇三人行路透 微博之夜 内娱提前过年 毁掉一个家庭只需要三分钟  姑娘往北走🎈🎈，小生往南瞧🎊🎊，自此不再打扰👍👍， ...全文,0,0,0,中国,湖北,孝感,🔝宋亚轩 刘耀文,874,1.1万,男,https://weibo.com/u/7538122709,https://m.weibo.cn/detail/P8QsMvism,P8QsMvism
5121082961167943,P8QsM4TPN,枫哥网事,2025-01-10 01:46:26,张颂文回剧组拍戏了，就是不回应家暴风波…… ,0,1,1,中国,黑龙江,哈尔滨,投稿 、推广 、直接私信 。信息来源：网友投稿以及网络 ，如有侵权请私信删除。,1252,8.4万,男,https://weibo.com/u/5671262076,https://m.weibo.cn/detail/P8QsM4TPN,P8QsM4TPN
5121082870988986,P8QsD49ho,小熊今天好好吃饭了嘛__鱼饼饼,2025-01-10 01:46:03,永远开心永远幸福@张颂文 //@颂琳一个彩色的梦:这两年我们真的很快乐很幸福，以后的每一天你也要开心快乐呀//@丸小熊不爱吃番茄 :以后的每一天你也要很快乐//@寄意寒星23 :这两年真的很快乐…因为有你@张颂文 。,0,0,0,中国,湖北,武汉,ᜊʕ ྀི . . . ྀིʔᜊ  一个喜欢张颂文的人再坏也坏不到哪去，熊门。,565,314,女,https://weibo.com/u/7362769158,https://m.weibo.cn/detail/P8QsD49ho,P8QsD49ho
5121082667565344,P8QsivK5G,一个不知名圈内人士,2025-01-10 01:45:16,#张颂文# 归园后第一件事就是用抱抱表达对小白的关心，接着叮嘱小白不能吃猫粮，还向小白炫耀朋友们送的树。小白：虽然明白这些都是爱，但一句也听不进去！#灿烂的花园# EP06正在热播中！ 一个不知名圈内人士的微博视频 ,0,0,1,中国,北京,北京,长江国际18楼旅客🧳,108,40.1万,男,https://weibo.com/u/6183820931,https://m.weibo.cn/detail/P8QsivK5G,P8QsivK5G
5120940061230937,P8MKi5adP,0x007e,2025-01-09 16:18:36,这个山东男的出手好阔绰一次就捐了18个张颂文 ,46,45,1090,中国,重庆,重庆,警告你不要来惹我,345,41.3万,男,https://weibo.com/u/5638578896,https://m.weibo.cn/detail/P8MKi5adP,P8MKi5adP
5121081998051248,P8QrdxMuQ,喝口瘦肉粥捏,2025-01-10 01:42:36,宝宝我知道你，你给胖猫点过外卖，觉得芭比里的ken好man你说你可以，骂过麦琳不知足，转头说杨子好惨被抢rs，真情实感梦过老实人李行亮，给“老艺术家”张颂文站台哭街，🫘阴上哭坟kris，你说哥哥好帅真糊涂，你觉得秦霄贤那么幽默的大男孩被网暴得都变沉默了，同时无条件相信覃海洋这个红又🧱的yd ...全文,0,0,0,中国,山西,太原,镇魂 白敬亭張元英全肯定bot 霖鏟朔千端水67朔童ack99 因數多隨緣寫 無差別攻擊 打拳 入贅男豆 磕夢公嬤一體機 沒有道德沒有素質,654,38,女,https://weibo.com/u/7829959757,https://m.weibo.cn/detail/P8QrdxMuQ,P8QrdxMuQ
5120995786758096,P8Ocasm5y,江苏卫视,2025-01-09 20:00:02,#江苏卫视清明上河图密码##清明上河图密码# 赵不尤@张颂文 以讼师身份在列举邹勉的七桩大罪，他控告了邹勉的种种罪行，最后还替天下百姓状告邹勉伪造祥瑞，粉饰太平，谄媚朝廷，愚弄百姓，可是邹勉拒不认罪。 江苏卫视的微博视频 ,0,3,14,中国,江苏,南京,有品质有温度只引领不跟随,503,939.1万,男,https://weibo.com/u/1575527140,https://m.weibo.cn/detail/P8Ocasm5y,P8Ocasm5y
5121081112789368,P8QpNbHDO,聆猫礼悸,2025-01-10 01:39:05,马天宇李明德发生什么了 李明德张颂文咋了 问古剑奇谭到底要塌多少次李明德床照为啥说小寒胜大寒 李明德涨粉 徐梦洁打开微博天塌了 马天宇回应李明德评论 凑个热闹 ,0,0,0,中国,广东,N/A,骂我先骂@峰峻文化,482,1.3万,女,https://weibo.com/u/6354732529,https://m.weibo.cn/detail/P8QpNbHDO,P8QpNbHDO
5121081023399935,P8QpEegtF,视频选录记,2025-01-10 01:38:44,《以爱为营》是由郭虎执导，白鹿（郑书意）、王鹤棣（时宴）、魏哲鸣（喻游）领衔主演，刘冬沁（关济）、姜珮瑶（毕若姗）特邀领衔，聂远（关向成）、曾黎（唐亦）特邀出演的都市言情剧。王鹤棣听到王鹤润名字的时候笑了 #王鹤棣张颂文# 狂飙父子## 尖叫之夜男明星怼脸生图 沈羽洁、刘铭浩、寇振海、王 ...全文,0,0,1,中国,北京,北京,绝对值得你一看！,155,17.1万,女,https://weibo.com/u/6293327907,https://m.weibo.cn/detail/P8QpEegtF,P8QpEegtF
5121079956210259,P8QnVq3zt,三花虾,2025-01-10 01:34:29,张颂文 📢📢📢📢📢📢📢📢📢📢📢📢  大家不要再给无关人员热度❗不要互动❗～  非正面的消息或话题，不带大名❗不带大名❗  负面话题，不要碰❗❗～不要碰❗❗～  遇到黑子，投诉聚宝❗❗～不要杠❗❗～  平时多发发好看的图频和正向的宣传 ～ . ,2,2,5,中国,辽宁,锦州,为颂文老师而来！！！,496,1391,女,https://weibo.com/u/7834659216,https://m.weibo.cn/detail/P8QnVq3zt,P8QnVq3zt
5121079947559440,P8QnUvIys,猫咪祉丞,2025-01-10 01:34:27,鱿鱼游戏吴京张颂文不回应曝顶流曾把女友藏行李箱偷摸见面被家暴16次女子直播带货声生不息传古法匠心香承胡姬花王慧玲封号胖东来公布员工结婚执行标准孙颖莎周边王楚钦和许昕儿子合照宋雨琦首个内娱红毯孙颖莎代言迪丽热巴今日chill一下广东女子错买断肠草煲汤致中毒身亡田亮我相信我的小棉袄会越来越 ...全文,0,6,6,中国,山东,淄博,幸福幸福请降临祉丞博文手心👐🏻,1023,1541,女,https://weibo.com/u/7936461043,https://m.weibo.cn/detail/P8QnUvIys,P8QnUvIys
5121079637443821,P8QnpvetD,这群人都不用上班的吗,2025-01-10 01:33:13,都怪张颂文    太久没见了，怪一下 ,0,0,0,中国,河南,新乡,不要关注我，不要关注我，不要关注我，谢谢大家合作，关注会被移除，莫怪（镇魂）,284,20,女,https://weibo.com/u/6236871793,https://m.weibo.cn/detail/P8QnpvetD,P8QnpvetD
5121079632724970,P8QnpbqT8,Thailandwaitforme,2025-01-10 01:33:12,#蔡徐坤捐款10万驰援西藏# 张颂文这次怎么连十块钱也不捐了 ,0,0,3,中国,山东,临沂,真想去泰国住一段时间呢，很喜欢真实的人和环境,23,13,女,https://weibo.com/u/6626696208,https://m.weibo.cn/detail/P8QnpbqT8,P8QnpbqT8
5121079190224910,P8QmH0WvA,美少女的颜控日记,2025-01-10 01:31:26,原来这件事已经过去两年了。 #启强落幕曲# #狂飙#   张颂文带来的回忆依然深刻。 美少女的颜控日记的微博视频 ,0,0,1,中国,北京,北京,最大的爱好就是看帅哥美女~ 每天一遍~~快乐无边~~,279,127.7万,女,https://weibo.com/u/6041830390,https://m.weibo.cn/detail/P8QmH0WvA,P8QmH0WvA
5121077466367134,P8QjUqInI,电影享不停,2025-01-10 01:24:35,#狂飙# #张颂文#  高启强对陈书婷是真爱！老婆说什么都答应，甜到了！ 电影享不停的微博视频 ,0,0,0,中国,天津,天津,美食,174,39.2万,女,https://weibo.com/u/6579088942,https://m.weibo.cn/detail/P8QjUqInI,P8QjUqInI
5121077430191559,P8QjR0NPF,天天把剧追,2025-01-10 01:24:27,#狂飙# #张颂文#  高启强耍阴招，雕塑里藏金条 天天把剧追的微博视频 ,0,1,0,中国,天津,天津,热播剧推送,142,38.5万,女,https://weibo.com/u/6579089293,https://m.weibo.cn/detail/P8QjR0NPF,P8QjR0NPF
5121007176652364,P8OuxrUAc,甄姬不放瓜,2025-01-09 20:45:17,话说张颂文没给西藏捐款？这老登怎么什么都能隐身，这nm太玄了 ,7,23,179,中国,北京,北京,红稿八卦 宣发私信联系,954,62.9万,女,https://weibo.com/u/3956055188,https://m.weibo.cn/detail/P8OuxrUAc,P8OuxrUAc
5121077170143649,P8Qjr0BmV,喜剧贼好看,2025-01-10 01:23:25,#狂飙# #张颂文#  张颂文唯一一次笑场，硬着头皮演，导演没删除意外成为经典 喜剧贼好看的微博视频 ,0,0,0,中国,天津,天津,,247,45.9万,女,https://weibo.com/u/6579479289,https://m.weibo.cn/detail/P8Qjr0BmV,P8Qjr0BmV
5121076324204839,P8Qi4hDRZ,广东刘金瑞,2025-01-10 01:20:03,所以网络yao言是怎么发挥作用的？ 这一次张颂文家暴的事情完美的展现出来了。 整件事情我们现在来捋一捋，感觉有一股熟悉的味道。 首先一个所谓的前女友不点名的诉说自己的遭遇，然后一个匿名的小号跳出来爆出更多黑料，接着一个利益相关的投资人出来诉苦，最后一个所谓的名人出来谴责。 整件事情一气 ...全文,0,0,1,中国,广东,韶关,跟上专业的指导，让投资变的更简单！,181,5万,男,https://weibo.com/u/5092754944,https://m.weibo.cn/detail/P8Qi4hDRZ,P8Qi4hDRZ
5121075241551726,P8Qgk6vFQ,大眼小龙虾0726,2025-01-10 01:15:45,张颂文#张颂文##全世界最好的张颂文#   今日晚间小作文  今天唯一的好消息就是，所以的黑热搜都已经消失不见了，也直接证明了颂文哥被“冤枉”的事情越发明朗了，不过也有坏消息，那两个女人的互撕欲还想把颂文哥拉下水，就算不拉下水，也想让这场闹剧继续延续下去，所以我们大家越到这个时候 ...全文,1,4,10,中国,吉林,长春,出口成张， 广为传颂， 尔雅温文。,511,503,女,https://weibo.com/u/5733675008,https://m.weibo.cn/detail/P8Qgk6vFQ,P8Qgk6vFQ
5121020707735144,P8OQmwsgo,tz-小红帽,2025-01-09 21:39:03,姜尘和黑张颂文的幕后黑手，这次真是踢到铁板了！ 他以为张颂文只是小糊咖， 可没想到他背后有众多名导演和人民日报 细数这次黑张颂文的幕后黑手做过哪些“好事”呢。 第一步让一个流窜到美国的姜尘先出来爆张颂文丑闻，引起热搜，再让人爆偷税漏税丑闻，再让人匿名爆料，说张颂文侵害一二十名 ...全文,2,2,12,中国,贵州,贵阳,恪守投资的初衷：保值；投资原则：选、等、守；好股好价好仓位，耕耘好一亩三分地。,354,19.4万,女,https://weibo.com/u/6972848816,https://m.weibo.cn/detail/P8OQmwsgo,P8OQmwsgo
5121074751340645,P8Qfx5CLj,院长应该都没有想到我逃了出来喵,2025-01-10 01:13:47,#微博之夜名场面又要来了#听说李明德要票，他能带上赵樱子并且当场和张颂文视频连线吗？ ,0,0,0,中国,山东,济南,,2760,141,女,https://weibo.com/u/1671533557,https://m.weibo.cn/detail/P8Qfx5CLj,P8Qfx5CLj
5121074620794129,P8Qfk3kAx,萌伤,2025-01-10 01:13:17,#上天猫年货节办地道家乡味#笑？有什么好笑的！我努力做了这么多事情，在你眼里，原来就是一场笑话。我出门的时候天空突然下雨，就像慕容云海和楚雨荨分手一样大！原来老天也知道我只是个笑话。三人行李明德评论马天宇回应李明德娱乐圈爆料李明德连发数条wb马天宇李明德床照李明德张颂文如此可爱的我们 ...全文,0,0,0,中国,山东,潍坊,亲吻你左耳的耳洞,196,7177,女,https://weibo.com/u/7588164519,https://m.weibo.cn/detail/P8Qfk3kAx,P8Qfk3kAx
