微博id,微博bid,微博作者,发布时间,微博内容,转发数,评论数,点赞数,国家,省份,城市,用户简介,用户关注数,粉丝数,性别,主页,url,uni_id
5121115339359006,P8RiZDgHI,貌似肥猫2013,2025-01-10 03:55:05,泰国人眼里的泰国都已经不再安全，对中国人来说还安全吗？#哔哩哔哩动画# 泰国人眼里的泰国都已经不再安全，对中国人来说还安全吗？ ,0,1,0,中国,四川,德阳,,157,55,男,https://weibo.com/u/3568332854,https://m.weibo.cn/detail/P8RiZDgHI,P8RiZDgHI
5121115295056009,P8RiVldix,Win_nie娜拉酱,2025-01-10 03:54:54,space更新～凌晨空降泰国演员frank ,0,0,0,中国,广东,广州,"I don't chase,I attract. 凡事发生皆有利于我               全网同名 物料看到什么就发什么 全平台更新",576,198,女,https://weibo.com/u/7815729404,https://m.weibo.cn/detail/P8RiVldix,P8RiVldix
5121115174732780,P8RiJjRda,魔匣中的潘朵拉,2025-01-10 03:54:26,#王星事件是否会影响泰国旅游业#希望国人一起抵制，不放人回来，绝对不去泰国旅游。 ,0,0,0,中国,北京,北京,啊,162,295,女,https://weibo.com/u/1904497037,https://m.weibo.cn/detail/P8RiJjRda,P8RiJjRda
5121012226066190,P8OCGps5M,请大家关注一下林美玲和许好宁,2025-01-09 21:05:21,#2女孩赴泰旅游被带入诈骗园区失联##诈骗##许好宁##林美玲##王星# ,256,191,792,中国,湖南,N/A,dy   小琦爱吃火锅,12,343,女,https://weibo.com/u/7546559593,https://m.weibo.cn/detail/P8OCGps5M,P8OCGps5M
5121115020853813,P8Riu3A7b,河流七七七,2025-01-10 03:53:49,今年真的被泰国女人抓的死死的.... ,0,0,0,中国,广西,来宾,时来运转 好运连连 顺顺顺风顺水顺财神,258,1,女,https://weibo.com/u/5334648156,https://m.weibo.cn/detail/P8Riu3A7b,P8Riu3A7b
5121114848625316,P8RicAbQ0,用户5606230519,2025-01-10 03:53:08,【好友：#有人称在妙瓦底某园区见过杨泽琪#，其父已办好护照随时赴泰】#中介称收100元帮转泰国招聘通告# 继演员王星失联事件后，1月8日，模特杨泽琪家人@古德牟宁 发文寻人，称其上个月赴泰拍戏时失联。据泰媒9日报道，泰国警方已开始调查模特杨泽琪失联案。杨泽琪朋友称，有一位从妙瓦底某园区内被赎 ...全文,0,0,0,中国,四川,成都,承接人物专访，海内外新闻发布。全国媒体邀约，纽约时代广场大屏纳斯达克大屏广告等，只做新闻界的观察家。 18140224612微信同步 爆料qq 3148526736,264,1.1万,女,https://weibo.com/u/5606230519,https://m.weibo.cn/detail/P8RicAbQ0,P8RicAbQ0
