微博id,微博bid,微博作者,发布时间,微博内容,转发数,评论数,点赞数,国家,省份,城市,用户简介,用户关注数,粉丝数,性别,主页,url,uni_id
3203137375.0,,四川观察,2024-12-05 15:04:04,【#想去冰雪大世界偶遇冰冰#】12月4日，哈尔滨冰雪大世界面向全国发起招募，凡是名字中含有“冰冰”或“雪雪”（名字必须为叠字，以个人有效身份证作为依据）的游客，均可在第二十六届哈尔滨冰雪大世界开园后（运营期内）凭个人有效身份证免费入园游玩一次。#冬天最好的解压药是看雪#网友：恭喜王冰冰 ...全文,15.0,29.0,46.0,中国,四川,成都,合作邮箱：sichuanguanchayy@qq.com,930.0,1460.4万,f,https://m.weibo.cn/u/3203137375?,https://m.weibo.cn/detail/P3siEBO84,P3siEBO84
5755011426.0,,影剧大叔,2024-12-06 09:30:34,王冰冰的颜值真是央视之光，美得能与娱乐圈明星一较高下 ,1.0,43.0,62.0,中国,湖北,黄冈,知名电影博主，商务jinengsusu,155.0,27.7万,m,https://m.weibo.cn/u/5755011426?,https://m.weibo.cn/detail/P3zxN0FoY,P3zxN0FoY
5519199499.0,,戳爷的火醬,2024-12-05 20:24:15,#名字含冰冰或雪雪可免费玩冰雪大世界#@范冰冰 @李冰冰 @王冰冰 带我去 ,0.0,6.0,21.0,中国,江苏,南京,how you don't miss me?,1348.0,1.4万,m,https://m.weibo.cn/u/5519199499?,https://m.weibo.cn/detail/P3uoCogKr,P3uoCogKr
6505463575.0,,霹雳时光机,2024-12-05 13:06:56,喜报！范冰冰、李冰冰、王冰冰，获得哈尔滨冰雪大世界免费入园游玩资格一次！ ,1.0,28.0,39.0,中国,北京,北京,您的电子榨菜和八卦秘书  📮chichimubin@qq.com  讨厌我又要看我的人一辈子都发不了财呢～,543.0,35.5万,f,https://m.weibo.cn/u/6505463575?,https://m.weibo.cn/detail/P3rx7vkqC,P3rx7vkqC
6614073323.0,,野间小舞,2024-11-29 20:16:05,《今日🐯谈》 ,60.0,28.0,232.0,中国,黑龙江,黑河,试图掳走小仓鼠,563.0,3520,f,https://m.weibo.cn/u/6614073323?,https://m.weibo.cn/detail/P2zMklS7v,P2zMklS7v
7621564678.0,,丝图侦探,2024-11-25 10:00:01,王冰冰 ,10.0,8.0,120.0,中国,湖南,株洲,分享美图和视频，以及二创视频剪辑，如有侵权请告知,1016.0,7.1万,m,https://m.weibo.cn/u/7621564678?,https://m.weibo.cn/detail/P1U2hn4A7,P1U2hn4A7
6926434215.0,P3tAM2pWh,发财好运小茶妹,2024-12-05 18:21:26,范冰冰李冰冰王冰冰你们日子也是好起来了，都能免费进冰雪大世界了 ,0.0,0.0,2.0,中国,浙江,宁波,关注我的会发财，骂我的人的正主和家人替我挡灾,264.0,4.2万,f,https://m.weibo.cn/u/6926434215?,https://m.weibo.cn/detail/P3tAM2pWh,
